ticket_id,body,human_billing,human_account,human_performance,human_security,human_bug,human_feature,human_network,human_hardware,human_software
7926,"Customer Support,<br>A major system crash has occurred, impacting several key applications vital to our digital strategy. The issue might be due to a software conflict. Attempts to reboot and reinstall the affected software have been unsuccessful. Despite our efforts, the problem continues, causing significant disruptions to our operations. We urgently need your assistance to resolve this matter to prevent further losses. Could you please provide guidance on the next steps? A technician is needed to be dispatched.",,,negative,,,,,,negative
5086,"Customer Support, reporting an issue with the investment optimization analysis report. The analysis failed due to data synchronization errors involving Oracle Database 19c and PHP 8.0. The possible cause might be version incompatibility or misconfigured connectors. Attempts to resolve the problem by restarting services, updating drivers, and verifying data pipelines were unsuccessful. We would greatly appreciate your assistance in resolving this issue. Please let us know how you can help.",,,,,negative,,,,negative
24200,"Dear Customer Support, I am writing to report a billing issue I am experiencing with several purchases made through the Tech Online Store using the Google Chrome extension for version 102.0. It seems there have been unexpected charges appearing on my account <acc_num>. The purchases listed do not align with my recent activities, and I believe there may be a glitch. I urgently require your assistance in resolving this matter. Please review the charges at your earliest convenience and advise on steps to correct the errors. My contact info is <tel_num>, and you may reach out to me directly if more details are needed. Thank you for your swift attention to this issue. Sincerely, <name>",negative,,,,negative,,,,
12110,Is there any information available on how hospital solutions secure medical data? I am keen to learn about the latest technological security measures that protect sensitive patient information.,,,,neutral,,,,,
11786,"The firm's data analytics tools are unable to synchronize investment data. Efforts to resolve this, such as restarting the systems and checking firewall settings, have not been successful.",,,,,,negative,,,negative
6935,"I am preparing a report on significant disruptions in digital marketing strategies due to software compatibility issues. Recent updates to key applications might be causing these problems. We have attempted reinstalling the affected software and updating device drivers, but the issue still persists. I would greatly appreciate your assistance in resolving this matter.",,,,,,negative,,,negative
24314,"Dear Customer Support, I am writing to request additional integrations with Jira Software to enhance project tracking and team collaboration. These additional features would greatly benefit our workflow by allowing us better control and oversight. Currently, we are using Jira Software 8.20, and are seeking enhancements that could provide more streamlined integration capabilities. We believe that improved interaction features will promote productivity across our team. Could you please provide information about any available integrations or upcoming updates that address these needs? Thank you for your time and support. Best regards, <name>",,,,,,neutral,,,
7751,"Noted an unforeseen charge on the billing summary. This might have arisen from a system glitch or communication error. After reviewing previous invoices and reaching out to support, the issue still exists. I would greatly appreciate it if you could look into this matter and provide a resolution at your earliest convenience.",negative,,,,negative,,,,
3702,A data security breach has taken place due to identified vulnerabilities. Efforts to scan and update systems were made.,,,,negative,,,,,
15884,"Dear Customer Support, I am writing to request improvements in security protocols that will better safeguard the medical data in our hospital's systems. It is crucial to protect sensitive patient information and prevent unauthorized access. I would greatly appreciate if you could look into this matter and implement the necessary measures to ensure the security of our medical data systems. Your attention to this important matter is highly appreciated.",,,,neutral,,,,,
7479,"Customer Support is encountering problems with the marketing tools, which are malfunctioning and impacting brand growth efforts. The issue might have begun with recent software updates, possibly due to hardware compatibility issues. Restarting devices and reinstalling software did not resolve the problem. We would greatly appreciate it if you could look into this matter and provide a solution as soon as possible. Please let us know if there is any additional information needed to resolve the issue. We are looking forward to your assistance.",,,,,,,,negative,negative
12605,"I am seeking assistance from customer support to understand the features and tools available in OBS Studio 27 that can help in creating engaging and informative presentations, particularly with investment data. I would appreciate any tips or practices that can help me use the software effectively for this purpose. Your guidance and any resources provided would be greatly appreciated. I look forward to hearing from you soon.",,,,,,neutral,,,
24913,"Dear IT Support Services Team, I am reaching out to urgently highlight a network outage that seems to have arisen from an improperly set up AWS Cloud configuration. This issue has had a significant impact on the AWS Management Service, which is a vital aspect of our operations. The outage is hindering our efficiency and affecting the timely delivery of our services to clients. Given the pressing nature of this issue, we request your expertise and immediate action to restore normal network operations. Additionally, we kindly ask for a detailed verification of the deployment to ensure that all configurations comply with industry standards and to mitigate any future occurrences. Please treat this issue with high priority, as it is crucial for our ongoing operation. Should you require more details, please feel free to reach out to me at your earliest convenience. Thank you for your swift attention to this critical matter. Best, <name> Position Company Name <email@domain.com> <tel_num>",,,negative,,,,negative,,negative
12034,"Dear customer support, I am requesting an immediate enhancement of security protocols for managing medical data in our hospital systems to ensure full compliance with data protection regulations.",,,,neutral,,,,,
15974,"Dear Customer Support, I would like to draw your attention to a pressing concern regarding our digital marketing strategies. Despite our efforts, we have not seen the desired growth in brand engagement and conversions. It appears that our current strategies are outdated and not resonating with our target audience. We have attempted to refresh our content and adjust our ad placements, but unfortunately, these tweaks have yielded minimal improvement. I would greatly appreciate it if we could discuss potential solutions to revamp our digital approach and better align it with our target audience.",,,,,,,,,
23535,"Dear Customer Support, I am experiencing an issue with uploading a project. The error message was not detailed, which made it difficult to ascertain the exact cause. This issue may have been due to a server overload or an internal coding problem within the platform. To address this, I have restarted my browser, cleared the cache, and verified my network connection to ensure it was stable. Unfortunately, these actions did not resolve the issue. Here are the specific details of the problem: - Occurred: Error message displayed during project upload. - Possible Cause: Server overload or coding issue. - Actions Taken: Restarted browser, cleared cache, checked network connection. I would be grateful if you could investigate this and provide a solution or instructions on how to proceed. If there is any further information needed from me to understand or resolve the issue, please let me know. Thank you for your time and assistance. Best regards",,,negative,,negative,,,,negative
20255,"I am facing an unanticipated login failure, which began after the latest security update. I have already attempted to restart my browser and clear the cache, but the issue remains unresolved. Could you please investigate and offer a solution at your earliest convenience? I look forward to your response.",,negative,,,,,,,negative
11083,"Hello, I am reaching out to inquire about integrating Keras with ClickUp for data analytics projects. Could you provide any information on this? I am interested in using Keras for machine learning tasks within a ClickUp project management framework. Any guidance or resources provided would be greatly appreciated.",,,,,,neutral,,,
19375,"Dear Support Team, I am reaching out to report an issue that I have experienced with my account. Recently, I discovered that my invoice contains charges that are not consistent with my subscription or product quantities. I have taken the following actions to address this: 1. Confirmed that my account details are correct and up-to-date. 2. Examined previous invoices for any irregularities or unusual transactions. 3. Communicated with your support team previously, but the issue remains unresolved. I would greatly appreciate your assistance in investigating this matter and resolving it promptly. If you require additional information from me, please let me know. Thank you for your attention to this matter. I look forward to your prompt response. Sincerely, [Your Name]",negative,,,,,,,,
132,"Medical technical equipment such as touchscreens, webcams, and Ubuntu-based systems are experiencing crashes and connectivity disruptions, probably due to conflicts caused by recent security patches affecting device drivers. Restarting devices, manual updates, and reverting patches have been effective in resolving these problems.",,,neutral,,,,neutral,neutral,neutral
24408,"Hello, I'm experiencing connection issues during critical video conferencing sessions while using Zoom 5.11.0. As this greatly impacts productivity, I seek high priority support to resolve these problems. Please address this matter as soon as possible to ensure smooth communication during important meetings. If needed, I can provide logs or further details. Contact me at <tel_num>. Thank you, <name>, Account number: <acc_num>.",,,,,,,negative,,negative
