ticket_id,body,human_billing,human_account,human_performance,human_security,human_bug,human_feature,human_network,human_hardware,human_software
12844,"Facing connectivity problems across several devices and applications, which is impacting project management tasks. It might be due to recent software updates or configuration changes. Despite restarting the devices and checking network settings, the issue still exists.",,,,,,,negative,,negative
14164,"An alert for unauthorized access has been triggered in the hospital's network, which may have jeopardized the security of medical data due to vulnerabilities in the network devices.",,,,negative,,,negative,,
20635,"To customer support, I am contacting you to report a recently discovered medical data breach that might be linked to a vulnerability in an outdated Git version. I've updated the firewall to mitigate further breaches. However, I require your support to fully address this issue and secure our medical information. Kindly inform me of the necessary actions. I value your swift response to this situation. Thank you for your assistance and cooperation.",,,,negative,,,,,negative
728,"The Screen Recorder has been failing intermittently, which might be related to server overload. After restarting the application, the problem still persists. I would appreciate it if you could look into this matter and provide a solution as soon as possible. Please inform me if there is any additional information needed to resolve the issue.",,,negative,,,,,,negative
21731,"There has been a detection of a medical data leak in our Elasticsearch database. It might be due to insufficient access controls and outdated software. Steps taken include restarting the server, reviewing the firewall settings, and updating Windows.",,,,negative,,,,,negative
12002,There was an attempt at a data breach on the systems. The issue might be due to outdated security software. Attempts to update McAfee for securing device access were unsuccessful.,,,,negative,,,,,negative
13963,"Dear Customer Support, I hope this message finds you well. I am reaching out to report an issue that has arisen with recent updates. Specifically, several integrations between Adobe Illustrator CC 2021 and Shopware are failing, and I suspect this might be due to compatibility issues. Despite my attempts to revert the updates and restart the application, the problems continue to persist. These failed integrations are causing significant disruptions to my workflow. I would greatly appreciate any assistance you can provide to resolve this matter and guide me through the necessary steps. If you require any additional information, please do not hesitate to ask. Thank you in advance for your help.",,,,,,negative,,,negative
5652,"I am seeking detailed instructions for integrating the Smart-Rauchmelder Notion into a scalable SaaS project management platform. I am interested in learning about the tools used together to streamline workflows and enhance productivity. Could you please provide a step-by-step guide on how to perform the integration, along with any additional resources or support options available? Your guidance on this matter would be greatly appreciated. Thank you for your time and assistance. I look forward to your prompt response.",,,,,,neutral,,,
23613,"Dear Customer Support Team, I am writing to report a critical issue I have encountered with the IntelliJ IDEA 2024.1, which is significantly impacting my project timeline. This matter is quite urgent as it is affecting our ability to complete a key deliverable on schedule. The issue began earlier this week when I attempted to complete some coding tasks in the IDE. Specifically, I am experiencing recurrent 'completion' errors that prevent the system from auto-suggesting code across various programming languages, which is a feature I rely heavily upon for efficient coding. Such a malfunction disrupts the coding routine and leads to increased time for tasks that would normally be streamlined through the use of IntelliJ IDEA's sophisticated development tools. Given the critical nature of this problem, as my project requires prompt and precise coding among team members, any delay caused due to manual coding processes could lead to missing the project deadlines. It's pressing to have this fixed to avoid significant impact on deliverables, which would further affect client relations and business standing. I have already checked for updates and verified that my IntelliJ IDEA installation is up to date. I also attempted to use 'Invalidate Caches/Restart', restarted the software, and even rebooted my computer to resolve the issue but to no avail. Additionally, all plugins used are compatible with the current version as per their documentation. However, no immediate relief has been obtained through these initial troubleshooting steps. I request urgent assistance from your technical support team to identify and resolve this issue. Please let me know if any additional information is required or if there's any particular error logs that you need me to send through. I am available for a remote session at a time convenient to the support staff to expedite the resolution of this problem. This problem is significantly slowing down our progress. An efficient IDE like IntelliJ is integral to our work processes, hence it is crucial to address the disruption swiftly. Thank you for your prompt attention to this matter. I look forward to your immediate response at your earliest convenience. Best regards, <name> <tel_num> <name> from XYZ Tech <tel_num> <email_address>",,,,,negative,,,,negative
13771,I need guidance on securing medical data using Notion in our hospital IT practices. Could you provide some practices and let me know a suitable time to call at <tel_num> for a detailed discussion on securing sensitive information in our current setup?,,,,neutral,,,,,
14942,"In regards to the report on the data breach in the hospital's system, sensitive medical data has been compromised. The breach might have happened due to inadequate security protocols and outdated software. Immediate actions have been taken, such as updating passwords and implementing two-factor authentication. Additionally, we have contacted the vendor for assistance, and we are awaiting their response. We would like to request guidance on how to proceed with the investigation to ensure the security of the system. Please provide us with information on the next steps and any additional measures to take.",,,,negative,,,,,negative
7581,Looking for detailed information on the billing cycles and payment options for the Smart-Wassermelder service. Could you provide me with the available plans and payment methods?,neutral,,,,,,,,
23920,"Dear Tech Online Store Support Team, I hope this message finds you well. I am writing to request a change in my current Microsoft Office 365 subscription plan. Presently, I am subscribed to the Basic services; however, I am interested in upgrading to the Premium services to better suit my usage requirements. Please let me know the process involved in making this change and any potential impact it may have on my current account, <acc_num>. Additionally, if there are any promotions or discounts applicable to the Premium plan, I would appreciate further information. Kindly contact me at your earliest convenience with the steps to proceed. You can reach me at my email or phone number, <tel_num>. Thank you for your assistance. Best regards, <name>",neutral,,,,,,,,
15039,"Faced a billing error for the subscription in the current month, which might be attributed to an issue with the payment processing platform. After re-entering payment details and reaching out to support for clarification, the problem still continues. I would greatly appreciate your assistance in resolving this matter to ensure my subscription is updated correctly. Please investigate and provide a solution to rectify the billing error as soon as possible.",negative,,,,,,,,
9921,"The agency's digital marketing strategies are not performing as expected, leading to lower than anticipated brand growth. There might be a misalignment between the target audience and the digital tactics employed. After analyzing the current campaigns and adjusting the messaging, the improvements have been limited.",,,,,,,,,
5340,"The data analytics platform experienced intermittent failures, which hindered the investment optimization process. The probable cause was software compatibility problems. To resolve the issue, the server was rebooted, the analytics software was reinstalled, and normal operation was restored, allowing investment optimization to continue. To prevent recurrence, it is recommended to thoroughly verify software compatibility and keep it updated regularly. Additionally, a backup system has been put in place to reduce the impact of potential future failures. Ensuring the system's stability remains a priority.",,,neutral,,,,,,neutral
959,"Customer Support: We are informing you that our SaaS platform experienced an unforeseen outage, probably due to server overload caused by a configuration mistake. Our team responded promptly by restarting servers, increasing resource allocation, and closely monitoring the situation to resolve the problem swiftly. These actions helped stabilize the platform, and diagnostics are ongoing to prevent similar incidents in the future. We apologize for any inconvenience caused and appreciate your understanding as we work to enhance service reliability.",,,neutral,,,,,,neutral
9066,"There are discrepancies in the investment analysis reports generated by the data analytics tools. These discrepancies may have arisen due to recent software updates or changes in the data source. Despite reinstalling the software, verifying data inputs, and clearing the cache, the issues persist. These discrepancies are causing inconsistencies in financial projections and affecting decision-making processes. I would appreciate it if you could look into this matter urgently and provide a solution or guidance to resolve the issue. Please let me know.",,,,,negative,,,,negative
11116,Experienced a billing problem.,negative,,,,,,,,
3037,"A healthcare provider has encountered data breaches that have compromised medical records, likely due to outdated security protocols. They have tried updating firewalls and resetting passwords to mitigate the issue. However, they require assistance to ensure that their security systems effectively safeguard sensitive patient information. Kindly provide guidance on the appropriate course of action to address this situation.",,,,negative,,,,,
13550,There is a potential compromise of medical data due to a software vulnerability in access controls. We have initiated a security audit to address this issue.,,,,negative,,,,,negative
11295,"Dear Customer Support Team, I am writing to request enhancements in our digital marketing strategies across various platforms. Our goal is to drive brand growth and improve customer engagement. We would like to explore new ways to reach our target audience and increase our online presence. Specifically, we are interested in optimizing social media campaigns, improving the user experience on our website, and developing targeted email marketing initiatives. We believe that leveraging these strategies will increase our brand's visibility and engagement.",,,,,,,,,
16932,Encountered unexpected downtime; recent updates might have caused configuration issues.,,,negative,,,,,,negative
10959,"Hello, there seems to be an overcharge in the digital marketing services that were provided last month. We believe this might be due to a mistake in the billing. We have already started a review of the invoices and reached out for clarification. We would greatly appreciate a detailed explanation regarding the overcharge and any errors found. Please also let us know the steps you will take to rectify this error to ensure accurate billing in the future. We look forward to hearing from you soon. Thank you.",negative,,,,,,,,
8783,Facing unexpected subscription charges for digital products associated with brand growth strategies. This might have happened due to the auto-renewal feature across multiple accounts. Have already checked the billing settings and tried to cancel the subscriptions but still facing issues.,negative,,,,,,,,
14976,I am seeking insights to enhance brand expansion using Elasticsearch. Could you provide strategies to optimize search and improve customer experience?,,,,,,neutral,,,
17845,"I would like to inquire about data analytics tools that can integrate with JIRA to optimize investments. Could you provide a list of compatible tools and their features, and explain how they can support data-driven decisions and enhance investment strategies? Additionally, could you share any information on pricing and implementation requirements? Thank you for your assistance and I look forward to your response.",neutral,,,,,neutral,,,
14611,"There has been a drop in brand engagement metrics. Recent adjustments to the algorithms may have missed the mark, leading to this decline. After analyzing the data and adjusting our strategies, we haven't seen the improvements we were hoping for yet.",,,,,,,,,
6413,Could offer advice on securing medical data with firewall switch solutions? Interested in learning about best practices for protecting sensitive medical information. Thank you for your assistance; look forward to your response soon.,,,,neutral,,,,,
8500,"Hi Customer Support, we have noticed an unauthorized access attempt on our hospital's system. This might be due to weak password policies and outdated software. We initially reviewed the access logs and have updated the passwords to enhance security. The security team is currently investigating the matter to identify the root cause and prevent future incidents. We would greatly appreciate your guidance on how to improve our system's security to prevent such unauthorized access attempts. Please provide any recommendations you can offer.",,negative,,negative,,,,,negative
22528,"Customer support, users are facing frequent disconnections during video calls. Issues include Google Meet data sync problems, WeChat, and Evernote. These may be due to server overload or configuration errors within Microsoft SQL Server 2019. Steps taken include restarting services, optimizing database queries, and increasing server capacity, but the issues continue. Assistance in resolving this matter would be greatly appreciated.",,,negative,,,,negative,,negative
24501,A client requires support for the software development of their organization's ticketing system.,,,,,,,,,neutral
16405,"Inquiring about Customer Support for healthcare data security solutions services offered by hospitals. Would appreciate details on the types of services provided, including data encryption, network security, and compliance management. Additionally, could provide relevant case studies and testimonials from working with hospitals. Also, interested in pricing and the implementation process. Looking forward to hearing back soon.",neutral,,,neutral,,,,,
13301,"Dear Customer Support, I am encountering service disruptions with several of your products, including IFTTT and DataRobot. The issue might be due to unexpected server overload. Initial steps have been taken to address the problem, such as restarting affected services and scaling server resources. However, the issues continue, and I require assistance to resolve them. I appreciate your prompt attention to this matter and look forward to your support in restoring full functionality to the services. Please let us know.",,,negative,,,,,,negative
11507,"The performance metrics of the marketing campaigns have plateaued. We have conducted an analysis of the ongoing campaigns, including A/B testing, but the results have not shown improvement. This might be due to outdated digital strategies and insufficient data analysis tools. We need your assistance to identify the root cause and implement effective solutions to enhance brand growth.",,,,,,,,,
12659,"Problems with devices linking to the WLAN-Router are believed to be due to network congestion. It seems there is insufficient bandwidth when multiple tools are being used simultaneously. Rebooting and re-establishing connections on the devices helped, but it affected productivity.",,,,,,,negative,,
3500,"I am seeking information regarding the security features of healthcare solutions. Could you supply detailed details on how sensitive medical information is protected? I am interested in understanding the measures implemented to prevent data breaches and ensure the confidentiality, integrity, and availability of patient data. This includes access controls, encryption techniques, and incident response strategies. I am particularly keen on learning about compliance with industry standards and regulations such as HIPAA. Please provide a comprehensive overview of your security features.",,,,neutral,,,,,
1382,"Campaigns are operational, server status is normal, but assistance is required to resolve the issues",,,,,,,,,
10867,Offer guidance on investment strategies through Xero data analytics,,,,,,neutral,,,
2839,Suspected network weakness identified; seeking resolution.,,,,,,,negative,,
23433,"Issue: Sudden slowdown in accessing medical data. Likely cause: Potential network configuration problem. Steps taken: Restarted servers, verified firewalls. Urgent need for your help to fix this to maintain continuous access to essential medical information.",,,negative,,,,negative,,
11587,Seeking information on the different billing options and payment integrations available for Monday.com. Would like to understand the available plans and how to set up payments.,neutral,,,,,,,,
9933,Could you provide details on the billing cycles for the Figma subscription? Thank you!,neutral,,,,,,,,
4209,"Our financial institution faced significant outages in data analytics tools including Outlook 2021, Visual Studio Code, and SAP ERP, likely due to server failures. Steps have been taken to mitigate the problem by restarting the affected applications and checking network connections. Additionally, we have restored system backups to ensure data integrity. We are currently monitoring the situation to prevent further disruptions. If the issue persists, we will investigate and take the necessary actions to resolve it.",,,negative,,,,,,negative
19905,"Recently encountered an issue with the subscription payment which was declined. The problem might be due to insufficient funds or a card expiration. After verifying the card details and ensuring there is a sufficient balance, the issue still persists.",negative,,,,,,,,
17058,"Last night, the protected portal malfunctioned. Could be due to a software defect or recent update. We've reinitiated the servers and verified the firewall configurations.",,,,,negative,,,,negative
4686,"Customer Support, reaching out to inquire about billing information and payment options for a marketing agency that promotes brand growth services. Could you please provide a detailed breakdown of the costs associated with various accepted payment methods? I would also appreciate it if you could inform me about any discounts or promotions currently available. Additionally, I am interested in knowing about any extra fees or charges I should be aware of. I am eager to learn more about the services offered by the marketing agency to help drive brand development.",neutral,,,,,,,,
24124,"Dear Customer Support Team, I am dealing with a flickering display problem on my Dell XPS 13 9310 laptop. Kindly help me with a resolution or assist me in going through the troubleshooting steps. Thank you, <name> <acc_num> <tel_num>",,,,,,,,negative,
21186,"Hello Customer Support, I am contacting you to address a billing discrepancy that I have noticed on my latest statement. I have been overcharged for services, which I believe to be a result of an error in invoicing or a rate change. After a thorough review of my invoices and consultations with the billing department, the issue remains unresolved. I kindly ask that you investigate this matter and take the appropriate actions to rectify the situation on my invoice. Please provide me with any additional details you may need to proceed with this. I can be reached via this email address for further information. I am looking forward to your prompt response and resolution. Thanks for your assistance.",negative,,,,,,,,
221,"Dear Customer Support, I am facing an issue where my printer releases excessive ink droplets onto the Logitech StreamCam. This problem began after recent firmware updates. I believe it may be due to a conflict with system drivers. I have already attempted reinstalling the drivers and resetting the StreamCam device, but the issue remains. Could you please help troubleshoot this problem? It is significantly disrupting my workflow, and I would appreciate guidance on resolving it, particularly regarding compatibility concerns.",,,,,negative,,,negative,
22476,"I recently ran into an unexpected error while creating a project. This error might be due to a configuration problem or server overload. To diagnose the problem, I have restarted the application, cleared the cache, and reviewed the system logs, but the issue still remains. I would appreciate your prompt assistance in resolving this. Please instruct me if there are any further actions for me to take or if you need more details.",,,negative,,negative,,,,negative
13590,"Dear Support Team, I faced an unexpected system crash while performing data analysis. It seems a possible overload of data might have triggered this. After restarting the system and clearing the cache, the issue still persists. The crash happened while processing a large dataset, and I suspect the system might not be able to handle the data volume. I have already checked for software updates and ensured hardware compatibility, but the problem still remains. I would greatly appreciate your help in resolving this issue.",,,negative,,,,,,negative
4946,"Customer Support, I am reaching out to inquire about the security protocols in place to safeguard patient information within healthcare solutions. Could you please provide detailed guidance on how the software maintains confidentiality, integrity, and availability of sensitive patient data? Additionally, I would like to know about the compatibility of these solutions with existing healthcare system software. What steps are taken to ensure smooth integration and to minimize disruptions to healthcare services? I would appreciate any documentation or resources you can provide on this matter.",,,,neutral,,neutral,,,
5012,"Customer Support is seeking advice on how to optimize investment strategies through data analytics tools. They are exploring various features and functionalities of the platform and would appreciate expert insights to maximize its potential. Specifically, they want to learn about different metrics and indicators provided by the tools to make well-informed investment choices. Could you please offer guidance on how to begin using these data analytics tools for investment optimization?",,,,,,neutral,,,
1969,"Customer Support, I am reporting a security breach incident involving unauthorized access attempts to medical data. The healthcare provider's system experienced multiple intrusion attempts, possibly due to insufficient firewall configurations. To address this, we updated the firewall rules and enabled multi-factor authentication. Despite these efforts, the issue continues. I am worried about the potential repercussions of this breach and seek assistance in resolving the problem. Please advise on the next steps.",,,,negative,,,,,
20884,"I am writing to seek information on the recommended security protocols for safeguarding medical data on KVM-Switch devices. Could you share the best practices for protecting sensitive medical information? I would value any guidance on encryption methods, access controls, and other security measures that can be applied to maintain the confidentiality and integrity of medical data.",,,,neutral,,,,,
23080,"I have recently been sent an inaccurate invoice. After cross-checking my account details, I believe there could be a system error or data discrepancy that has led to this mistake. Even after reaching out to your customer support team, the issue remains unresolved. I kindly request your assistance in addressing this and guaranteeing the precision of my invoices going forward. I would appreciate it if you could look into this and supply a corrected invoice at the earliest convenience.",negative,,,,,,,,
15330,"Dear Customer Support, I am inquiring about the data analytics services you offer, particularly how they can be used to optimize investment strategies. Could you provide detailed information on the types of services you offer, such as predictive modeling, portfolio analysis, and risk assessment? I would greatly appreciate any case studies or examples of how you have assisted clients in the past. Additionally, could you provide information on the cost and implementation process for these services? I look forward to hearing back from you soon.",neutral,,,,,neutral,,,
4809,"Customer Support has documented an unexpected crash in the digital campaign platform. The crash happened suddenly without prior warning. It is suspected that software conflicts or overload may be the cause. The team has tried to resolve the problem by restarting systems and updating relevant products, but these efforts have not yet succeeded. We are concerned about the potential disruption to marketing activities and urgently request assistance to resolve this issue. Could you please investigate the problem and suggest a solution?",,,negative,,,,,,negative
